{
  "$schema": "https://json-schema.org/draft/2020-12/schema",
  "$id": "web-protocol-recovery-case.schema.json",
  "title": "web-protocol-recovery case",
  "type": "object",
  "required": ["schemaVersion", "caseId", "revision", "status", "family", "runtime", "caseKind", "implementation", "match", "artifacts", "verification", "verificationClass", "requiresFreshVerification", "secretPolicy"],
  "properties": {
    "schemaVersion": {"const": "web-protocol-recovery-case"},
    "caseId": {"type": "string", "minLength": 1},
    "revision": {"type": "integer", "minimum": 1},
    "status": {"enum": ["verified", "stale", "deprecated"]},
    "family": {"enum": ["signer", "challenge", "verifier", "decode", "session", "transport"]},
    "runtime": {"enum": ["iv8", "python-node", "pure-python"]},
    "caseKind": {"enum": ["evidence", "implementation"]},
    "implementation": {
      "type": ["object", "null"],
      "properties": {
        "mode": {"enum": ["iv8", "python-node", "pure-python"]},
        "strategy": {"type": ["string", "null"]},
        "profile": {"type": ["string", "null"]}
      }
    },
    "historicalReferences": {
      "type": "array",
      "items": {
        "type": "object",
        "required": ["manifestPath", "archivePath", "sha256", "bytes", "sourceCommit", "readPolicy"],
        "properties": {
          "manifestPath": {"const": "references/case-live-reference-archive/MANIFEST.json"},
          "archivePath": {"type": "string", "pattern": "^references/case-live-reference-archive/"},
          "sha256": {"type": "string", "pattern": "^[0-9a-f]{64}$"},
          "bytes": {"type": "integer", "minimum": 1},
          "sourceCommit": {"type": "string", "minLength": 1},
          "readPolicy": {"const": "study-only"}
        },
        "additionalProperties": false
      }
    },
    "sourceStage": {"type": "object"},
    "historicalProviderChain": {"type": "array"},
    "requiredCurrentProviderChain": {"type": "array"},
    "match": {
      "type": "object",
      "required": ["signals", "minimumIndependentSignals", "negativeSignals"],
      "properties": {
        "signals": {
          "type": "array",
          "items": {"type": "string", "minLength": 1},
          "uniqueItems": true
        },
        "minimumIndependentSignals": {"type": "integer", "minimum": 1},
        "negativeSignals": {
          "type": "array",
          "items": {"type": "string", "minLength": 1},
          "uniqueItems": true
        },
        "requiredSignalGroups": {
          "type": "array",
          "minItems": 2,
          "items": {
            "type": "object",
            "required": ["name", "anyOf"],
            "properties": {
              "name": {"type": "string", "minLength": 1},
              "anyOf": {
                "type": "array",
                "minItems": 1,
                "items": {"type": "string", "minLength": 1},
                "uniqueItems": true
              }
            },
            "additionalProperties": false
          }
        }
      },
      "additionalProperties": false
    },
    "exactScopes": {"type": "array"},
    "protocolPatterns": {"type": "array"},
    "product": {"type": "object"},
    "dependencies": {"type": "object"},
    "liveState": {"type": "object"},
    "artifacts": {"type": "object"},
    "verification": {"type": "object"},
    "verificationClass": {"enum": ["freshly-verified", "historical-user-attested"]},
    "requiresFreshVerification": {"type": "boolean"},
    "secretPolicy": {"const": "redacted-pull-live"}
  },
  "allOf": [
    {
      "if": {"properties": {"caseKind": {"const": "evidence"}}, "required": ["caseKind"]},
      "then": {
        "required": ["implementation"],
        "properties": {
          "implementation": {"type": "null"},
          "artifacts": {
            "not": {"required": ["entry"]}
          }
        }
      }
    },
    {
      "if": {"properties": {"caseKind": {"const": "implementation"}}, "required": ["caseKind"]},
      "then": {
        "required": ["implementation"],
        "properties": {
          "implementation": {"type": "object", "required": ["mode"]},
          "artifacts": {"required": ["entry"]}
        }
      }
    },
    {
      "if": {
        "properties": {"verificationClass": {"const": "historical-user-attested"}},
        "required": ["verificationClass"]
      },
      "then": {
        "required": ["requiresFreshVerification"],
        "properties": {
          "caseKind": {"const": "evidence"},
          "requiresFreshVerification": {"const": true}
        }
      }
    }
  ]
}
