{
  "schemaVersion": "web-protocol-recovery-case",
  "caseId": "python-node-pzds-aliyun-v2-goods-public",
  "revision": 21,
  "status": "verified",
  "family": "verifier",
  "runtime": "python-node",
  "caseKind": "implementation",
  "verificationClass": "freshly-verified",
  "requiresFreshVerification": true,
  "secretPolicy": "redacted-pull-live",
  "match": {
    "signals": [
      "site:pzds",
      "api:goodsPublic/page",
      "vendor:aliyun-captcha-v2",
      "action:InitCaptchaV2",
      "action:VerifyCaptchaV2",
      "sidecar:DeviceConfig-Log2-Log3",
      "success:T001",
      "wasm:pzds-505c6f51-generate_sign",
      "header:X-Sign-Version-v18"
    ],
    "minimumIndependentSignals": 3,
    "negativeSignals": [
      "vendor:akamai",
      "vendor:river-security",
      "alias:ruishu",
      "vendor:geetest",
      "vendor:tencent-tdc",
      "runtime:pure-python-only",
      "path:manual-slider-default",
      "path:decode1174-required"
    ]
  },
  "exactScopes": [
    {
      "scheme": "https",
      "host": "www.pzds.com",
      "port": 443,
      "routePrefix": "/goodsList"
    },
    {
      "scheme": "https",
      "host": "api.pzds.com",
      "port": 443,
      "routePrefix": "/api/web-client/v2/public/goodsPublic/page"
    },
    {
      "scheme": "https",
      "host": "device.captcha-open.aliyuncs.com",
      "port": 443,
      "routePrefix": "/"
    },
    {
      "scheme": "https",
      "host": "18152c0dc559302765e69a8f8bf3c191.captcha-pro-open.aliyuncs.com",
      "port": 443,
      "routePrefix": "/"
    },
    {
      "scheme": "https",
      "host": "18152c0dc559302765e69a8f8bf3c191-verify.captcha-pro-open.aliyuncs.com",
      "port": 443,
      "routePrefix": "/"
    }
  ],
  "protocolPatterns": [
    "vendor:aliyun-captcha-v2",
    "captcha-type:sliding",
    "success:T001",
    "sidecar:Log2-Log3",
    "business-header:Sign-PZTimestamp-Random",
    "business-api:goodsPublic/page",
    "runtime:python-node-wasm",
    "login:password-md5-oauth"
  ],
  "product": {
    "vendor": "Aliyun",
    "product": "Captcha V2 WAF",
    "version": "FeiLin111/133/142/033/038/039 observed through feilin039 / PZDS X-Sign-Version v18",
    "subtype": "sliding-t001-pzds-goods-public"
  },
  "dependencies": {
    "python": ">=3.10",
    "node": "required for local helper assets; nv8 backend additionally needs the project-local nv8 package",
    "pycryptodome": "offline vectors and live replay",
    "curl_cffi": "live replay only",
    "websocket-client": "raw CDP profile refresh fallback only",
    "local_browser": "optional; raw CDP refresh fallback (ordinary Chrome first, optional CloakBrowser)",
    "nv8": "browser-free profile refresh backend (EdgeSandbox + networkRelay; see the nv8 repository docs/target-playbooks/aliyun-v2-pzds.md)"
  },
  "liveState": {
    "mode": "project-profile-and-session-required",
    "retention": "project-local-only",
    "requiredCookies": [],
    "optionalCookies": [],
    "storageKeys": [],
    "profile": "js_reverse_cache/private/pzds/t001_profile.json only after raw-secret-handling; not stored in this case",
    "session": "js_reverse_cache/private/pzds/session.json only after raw-secret-handling; requires token",
    "credentials": "ask user for username/password when token is missing; keep in memory unless an exact raw-secret decision permits config.local.json"
  },
  "artifacts": {
    "process": {
      "path": "PROCESS.md",
      "sha256": "28e96d351a4571620fba308c6bc4eccd87d274209a058870ebbe7e9627695db8"
    },
    "entry": {
      "path": "entry.py",
      "sha256": "c1c4cf29c3618fdb0194374288ed232900697608c7a7b6c159fa5ba4b87c77a2"
    },
    "pullLiveState": {
      "path": "pull_live_state.py",
      "sha256": "b6972f341aec2386c71c1cc967eb3ddd8eb9fd852dc7071f0ae730c47d3ca89f"
    },
    "assets": [
      {
        "path": "fixtures/vectors.json",
        "sha256": "b6516f4332c04e3ce21a46a911ca76c2d0b318fbb9fca7426a94e2f9b09d7cec"
      },
      {
        "path": "fixtures/track-template.json",
        "sha256": "383bfdbcc6802bec98dfdd2fd5ceceda9fbbc342a2da4d5cebf2725259f36049"
      },
      {
        "path": "fixtures/request.sample.json",
        "sha256": "3831e69b7705fef33fdbbcee7e74f3dc49e44967de4d770811ded510cb1b3635"
      },
      {
        "path": "fixtures/response.sample.json",
        "sha256": "2ea3bd208cc610f9e77882e13f8fc509a184f34dc88fe9cef8ccfc8112ec0104"
      },
      {
        "path": "fixtures/live-proof.summary.json",
        "sha256": "df0165c5766389428d3ac96787c243fb4e9f803d0875909b546957a58266a0b2"
      },
      {
        "path": "fixtures/offline-proof.summary.json",
        "sha256": "f76fa6d8021814dc4ced732b3325e4c754a315fd6662fa6cbae5b05a386be6bf"
      },
      {
        "path": "assets/data_builder.js",
        "sha256": "1d493a4c3536d94a0938390e1d3aa0c6fe3f6d6fa93976c4cb24cffcc09635a4"
      },
      {
        "path": "assets/vm_codec.js",
        "sha256": "cb79d74688738f3bc6e4ac8582d3f62ffac2aa4a27d87f7a3831295e373d6143"
      },
      {
        "path": "assets/pzds_wasm_sign.mjs",
        "sha256": "c001cde155e4c4b98cdb0dd779b615f32fde01a9e659034c5677b1a9ba980fe1"
      },
      {
        "path": "assets/pzds_wasm_glue_64c90705.mjs",
        "sha256": "3b4d2355e115ae96affb0f1bdf927f462fc3166b962db7b30d7a9454296343d3"
      },
      {
        "path": "assets/505c6f51.wasm",
        "sha256": "932a4bd29706f3de80a203f73bcef14a104b4efbf95375a1474a53def1e60d09"
      }
    ]
  },
  "verification": {
    "executed": true,
    "passed": true,
    "executedAt": "2026-10-06T14:00:00+0800",
    "testCommand": "python -m unittest discover -s tests -v",
    "testArtifact": {
      "path": "tests/test_vectors.py",
      "sha256": "6df065650e0ac03bd4d4369720ac36bf521a58ea7e4b639ecb81a728fb9d6381"
    },
    "evidenceArtifact": {
      "path": "fixtures/offline-proof.summary.json",
      "sha256": "f76fa6d8021814dc4ced732b3325e4c754a315fd6662fa6cbae5b05a386be6bf"
    },
    "proof": {
      "activeScope": "offline-only",
      "offlineAcceptance": "request, classic and generation-specific field21 (feilin142/feilin033), RPC, token, DeviceConfig, 111/133/142 Log2 profile shape, Log2/Log3 envelope, verify params, and challenge-parser vectors pass without live network egress; target JS/WASM artifacts remain blocked unless a current approved runner is supplied",
      "caseLocalTests": "python -m unittest discover -s tests -v",
      "currentEntrySha256": "c1c4cf29c3618fdb0194374288ed232900697608c7a7b6c159fa5ba4b87c77a2",
      "currentTestArtifactSha256": "6df065650e0ac03bd4d4369720ac36bf521a58ea7e4b639ecb81a728fb9d6381",
      "historicalLiveProof": {
        "classification": "historical-project-provenance",
        "executedAt": "2026-08-03",
        "currentAcceptance": false,
        "evidencePath": "fixtures/live-proof.summary.json",
        "summary": "Prior live business replay is provenance only and requires fresh current-target verification with project login session and FeiLin profile."
      }
    }
  },
  "implementation": {
    "mode": "python-node",
    "strategy": "wasm-sidecar",
    "profile": null
  },
  "sourceStage": {
    "provider": "python-collector",
    "role": "delivery",
    "purpose": "source evidence"
  },
  "historicalProviderChain": [
    {
      "provider": "chromium-recon",
      "role": "reconnaissance"
    },
    {
      "provider": "verifier",
      "role": "protocol-recovery"
    },
    {
      "provider": "python-collector",
      "role": "delivery"
    }
  ],
  "requiredCurrentProviderChain": [
    {
      "provider": "chromium-recon",
      "role": "reconnaissance",
      "purpose": "current-target evidence"
    },
    {
      "provider": "verifier",
      "role": "protocol-recovery",
      "purpose": "protocol owner"
    },
    {
      "provider": "python-node",
      "role": "implementation",
      "purpose": "wasm sidecar artifact",
      "ownerProvider": "verifier",
      "strategy": "wasm-sidecar"
    },
    {
      "provider": "python-collector",
      "role": "delivery",
      "purpose": "delivery"
    }
  ]
}
